timestamp,title,speech
21 June 2023  - 14:51 ,"When we build Ukraine, we will build freedom – online speech by President Volodymyr Zelenskyy at the Ukraine Recovery Conference in London",", Thank you very much!, Happy to see you, Rishi, Mr. Prime Minister!, Thank you for your kind words about Ukraine, about our soldiers, and thanks for your leadership and support the UK provides to Ukraine., Thank you that we are really united in defending freedom., Dear leaders of politics, business and public opinion!, Dear Presidents, Prime Ministers, Ministers, Secretaries, CEOs and heads of international organizations!, And, of course, dear journalists!, When we are talking about recovery, we are talking about millions of jobs, billions in corporate profits and trillions of GDPs. And not only for Ukraine, but for all our countries – mine and yours. Countries that want and will live freely despite any predatory ambitions of various ""putins"", whose brains are poisoned by dreams of war., Growth is always based on values. Just as strong investments are preceded by trust, so the growth that we are preparing must be preceded by confidence that what has been rebuilt will not fall. And it's not about bricks, but about life in general., , The world is abundant with ruins reminding us of the wars of the past. And politics in different regions, unfortunately, is abundant with sick ideas of hatred and resentment, which point to possible wars in the future. And although no one has the power to cleanse the depths of human nature from the evil that sometimes rises to the surface and destroys and kills... But you and I, and right now, we are able to protect life and overcome the ruins after the Russian aggression in such a way as to block the path for evil – meaning for any new aggressions., The eyes of the world are looking at us. And at whether we will defeat Russian aggression exactly as freedom deserves to win – that is, without compromising our values. Also the world is watching to see if we will restore normal life in such a way that our transformation will land an ideological defeat on the aggressor., We protect Ukraine and thus we protect freedom, and when we build Ukraine – we’ll build freedom. Country, region, continent, world… It’s a global task., And I want to thank you. And, of course, I thank Switzerland, Germany, France, Italy – every country where we have agreed on key principles for recovery. At this Conference, we must move from vision to agreements, and from agreements to real projects., There is a Ukrainian delegation in London that will present concrete things that we propose to do together. In my turn, I will outline five directions in which we have begun to create foundations for peace. , The first is the potential of unity. The second is the potential of stability. The third is growth potential. The fourth is security potential. And the fifth – extremely important – is the potential of democracy., So, the first point – we are strengthening unity., Ukraine has already succeeded in making the EU as united as it has never been before. This is truly a unity of values, which is reflected in many political, economic, sanction and humanitarian decisions. Ukraine has activated all that power of solidarity for which the EU was conceived., And Ukraine is also activating the moral force of NATO. This is important for all of us. What does the world see now? Does it recognize NATO's moral leadership in protecting peace? This is only possible with Ukraine in the Alliance., Just as Ukraine already belongs to the value space of the EU, we already belong to the NATO security space. De facto. Just as Ukraine is already part of the EU's common market and on its way to full membership, we are already defending the common space of freedom in the Alliance and are only waiting for the courage of the Alliance leaders to recognize this reality politically., Thanks to the same values, we are developing strong bilateral alliances with such leaders of the democratic world as the United Kingdom, the USA, Canada, Japan, Australia, all the EU members. And this gives us new power in defense, economy and global prospects for democracy., We build our alliances and thus we are safeguarding the level of freedom to which our people are used to., , Second – we are strengthening stability., At least 600 million consumers around the world directly depend on our agricultural production. This is a huge potential for food security., At the times of this war, when Russia blocked our ports and destroyed freedom of navigation in the Black and Azov Seas, the world saw what Ukrainian grain is. Without it, there is a threat of price crises and social collapse in different countries., We have now partially restored the movement of our agricultural products by sea through two export initiatives. And this is stability for a huge social and economic space – from Morocco to Somalia, from China to Lebanon, from Türkiye to India, from Spain to Pakistan. Different aspects, different influences, but always a contribution to stability., Another similar area is the energy sector., I believe that there is no alternative to the green transformation of the economy, and Russian aggression has proven that green transformation is one of the key foundations of security. Each strike on our energy facilities and each manifestation of Russian blackmail with the energy crisis ends the era of fossil fuel dominance and old energy habits, when entire regions could depend on a single supplier, such as Russia., It is green energy that guarantees real energy stability. Ukraine can be – and will be! – one of the key suppliers of clean electricity and green hydrogen to Europe. The potential of this industry alone is about four hundred billion dollars., We build agricultural and energy facilities in Ukraine and thus we’re protecting the world from chaos., Third point – we strengthen the growth. , There is currently no place in the world where there is a need to construct and rebuild as many objects as in Ukraine. Every new day of Russian aggression brings new ruins. Thousands and thousands of destroyed houses, devastated industries, burnt lives… Recently, Russia committed also the largest crime of ecocide in Europe by blowing up the dam and other structures of the Kakhovka Hydroelectric Power Plant. , What does all this mean? In Ukraine, there is the largest source of economic, industrial and technological growth in Europe for decades and decades. And, by the way, it's not only reconstruction., For example, the green transformation of energy logically stimulates the development of industries such as green metallurgy and green fertilizers. Thanks to its natural resources and industrial traditions, Ukraine can become one of the key global centers of green metallurgy. In addition, we have significant reserves of critical resources for the modern economy, such as lithium. , By building with Ukraine and in Ukraine, we fend off our countries and our countries' companies from recessions., Fourth point – we strengthen security. , This war demonstrates what effective defense against aggression in the modern world means… , , What weapons are needed and to what extent, what infrastructure is lacking and what production is a priority, what technologies save lives on a large scale, and what systems make it possible to make science fiction a reality on the battlefield. From the production of combat drones to conventional artillery, from an air shield that covers the entire country or even a region to shelters in every school, from infrastructure that is built so that it cannot be destroyed by the Iranian ""Shaheds"" to cyberspace that remains resilient even in the face of constant cyberattacks., We are doing all of this in Ukraine, and we need the experience of partners in all of this. We build security together and thus we convince the world that democracies cannot be defeated., And finally, the fifth point – democracy., Russia invaded Ukraine not only to steal our land, resources and people. It is obvious that without Ukraine there can be no Russian Empire. , And it is equally obvious that Russia's bosses are very afraid of our democracy. Why? Because democracy paves the way for the rule of law, getting rid of corruption and to the key principle of our countries – every person matters. It is very important., Of course, democracy is in the nature of Ukrainians. And we would strengthen it anyway, no matter what they think or do in Russia. , But we all have to realize that the more democracy we have, the greater its strength in our entire region. The more rule of law we have, the more law will work here on the eastern flank of Europe. And the more transparent Ukraine is, the uglier any corruption model will look in Russia., Even Russia's full-scale aggression has not stopped our internal reforms., Ukraine will be associated with a fair court, just as it is now associated with courage. Step by step, we will get there., Thanks to digital transformation, we will show the world how the state can function effectively without any contact between an official and a citizen or a company. All public services can and will be transferred online – from business registration or social assistance to any other public service. And we are already exporting our digitalization to other regions and other countries. We have started such cooperation with Estonia and will continue with Colombia and Zambia. And I am sure that this is just the beginning. Please be sure to ask our team, our government officials for more details about this… this is truly an example of social progress through technology. , , Even before February 24th, we started dismantling the old oligarchic model of economic relations from the post-Soviet period. And this is not just something about the personalities of the oligarchs, it is about changing the approach to economic relations. Financial transparency and banking system resilience, market liberalization and competition stimulation, guaranteeing equal and legal conditions for every economic entity – are all areas in which we made progress before February 24 and which are very important now., We build institutions and continue reforms in Ukraine and thus we are defending democracy and preserving it as a hope for all, at least in our region, that democracy will prevail., Ladies and Gentlemen!, By building Ukraine, we are building much more than one country. We build the world as it will be during the lifetime of our generation and after us. Will it be peaceful? Will it be stable? Will it be democratic? , It depends on each and everyone of us. , I invite all of you to Ukraine! By the way, Prime Minister Rishi, we have not seen each other in Kyiv for quite a while… , Thank you for your attention! Thank you for your support! , Thank you UK!, Слава Україні!"
20 June 2023  - 22:01 ,A rebuilt and strengthened Ukraine means protection against all forms of Russian terror - address by President Volodymyr Zelenskyy,", I wish you health, dear Ukrainians!, A brief report on this day., First of all, I thank our Air Force and all the defenders of the sky from our other defense forces for every downed Russian missile and Shahed. Last night alone, more than 30 Shaheds were shot down. These are hundreds of saved lives, saved infrastructure. Thank you, warriors!, Second. Today in Kherson, rescuers were injured as a result of the occupiers' shelling... They were relieving the consequences of the Russian act of terrorism at the Kakhovka hydroelectric power plant and were shelled by Russian artillery. Eight SES workers were injured, one, unfortunately, was killed... My condolences to their families and friends! Ukrainian warriors will definitely give the terrorists a response to all this meanness., Every such Russian strike, every Russian terrorist attack is an argument that the occupiers have no chance of staying anywhere on Ukrainian soil. There is no place here for murderers and terrorists and there will never be., Now our warriors in the south and in the east are very actively destroying the enemy, physically clearing Ukraine. This will continue in the future., Protection against terror means the destruction of terrorists. And it is a guarantee that the evil state will never again have the opportunity to bring evil to Ukraine. This is what the third point is about today. The first meetings have already begun in London in the framework of the conference on Ukraine's recovery, which we have been preparing together with our British friends. Discussions have already taken place in Switzerland and Germany, in France and Italy. There is work at various levels for our recovery. And we are directing this work in such a way that our reconstruction, our recovery will become not only construction projects, but also a global project of protection., A rebuilt Ukraine, a transformed Ukraine, a strengthened Ukraine is a carrier of security and a guarantor of security, it is protection against any form of Russian terror and protection against any repetition of Russian aggression., Tomorrow at the London conference, I will present some aspects of our philosophy of Ukraine's transformation. The full vision will be presented later this month. And already in Ukraine., Together with our partners and all of us here at home in Ukraine, we must ensure that only security, freedom and peace will come after us., I thank everyone who is fighting and working for Ukraine! I thank each of our warriors who are now in combat, at combat posts and on combat missions! Zaporizhzhia, Donetsk region - well done, guys!, I am grateful to everyone who trains our soldiers and helps us with weapons! Ukraine uses every weapon and every shell as efficiently as possible and always to protect lives., Glory to Ukraine!"
19 June 2023  - 22:16 ,The evil state has no such fortifications or reserves that will stop Ukraine - address by President Volodymyr Zelenskyy,", Good health to you, fellow Ukrainians!, A report on this day., The Staff. First of all, the frontline, specific issues of the offensive. There were reports from senior commanders and commanders directly from the battlefields. There was also a report by the Commander-in-Chief, the Chief of the Main Intelligence Directorate., Separately and in detail, we considered the preparation and provision of equipment for the new brigades of the National Guard and our border guards - those who are waiting for their time to engage in combat operations., In some areas our warriors are moving forward, in some areas they are defending their positions and resisting the occupiers' assaults and intensified attacks. We have no lost positions. Only liberated ones. They have only losses. In general, it is a situation of pressure, our pressure, which allows us to pave the way for our flag. Blue and yellow colors will be all over our south and all over our east. And the evil state has no such fortifications or reserves that will stop Ukraine. Because we are on our own land, and this gives us the greatest strength., I thank all of our warriors - every soldier, every sergeant, every officer and every general who are involved in our active offensive and defensive actions now. I thank you for each liberated and each defended position!, Today, in a conversation with British Prime Minister Rishi Sunak, I outlined our current defense needs and thanked him for the defense support provided. For example, the British Storm Shadow long-range missiles are doing a very useful and accurate job at the front. As well as many other weapons supplied by the British. And this cooperation will have a significant continuation., Of course, we discussed with Rishi, with Mr. Prime Minister, the preparations for the NATO Summit in Vilnius and the content of this meeting of the Alliance., Today, there is also a significant political decision by the UK regarding sanctions - to maintain sanctions against Russia until the aggressor compensates for all the damage done to our people and our country. And it is very important that the assets of the aggressor state and all those associated with it, associated with the system of domination that the Kremlin has built on the territory of Russia, are used to compensate for the damage caused by the Russian war and terror. This will be fair, and I am grateful to all British people who support us on the path to justice., We also discussed with Rishi the preparations for the conference on Ukraine's reconstruction in London. It will take place in the coming days, and we expect it to consolidate various international efforts, including those of big business, to support our recovery. A recovery that should demonstrate to the world that freedom is invincible., I discussed the conference, financial cooperation, and our movement towards the EU with President of the European Commission Ursula von der Leyen. This week we are expecting an interim verbal assessment of our work on the European Commission's recommendations. We discussed sanctions issues in detail, in particular the 11th sanctions package against Russia for the war., Today I also spoke with Prime Minister of the Netherlands Mark Rutte and Prime Minister of Denmark Mette Frederiksen. As always, we paid attention to the frontline and our joint defense efforts, and I thanked them for their support and willingness to develop our cooperation for security., I informed them about the talks with African leaders and representatives who visited Ukraine last week and then visited the terrorist state. Each such international step only convinces again and again that the world should work more actively with the Peace Formula. Because this is the only Formula that responds comprehensively enough to every aspect of Russian madness., And one more thing., The World Bank. I spoke with the President of the Bank today. And not only about cooperation now, but also about the post-war transformation of Ukraine. About the decisions and steps, about the new doctrine of a new Ukraine, a victorious Ukraine, steps that we will prepare and implement. All together. Just as we are now overcoming this aggression together., I am grateful to everyone who is now in combat, at combat posts, in combat positions!, Today I would like to highlight the Artan assault unit of the Main Intelligence Directorate and its commander, Major Torkotiuk. Thank you!, And also our Special Operations Forces. Viktor, all the guys - thank you very much!, Thank you to everyone who is fighting and working for Ukraine!, Glory to Ukraine!"
18 June 2023  - 22:31 ,"Our troops are advancing, step by step we are moving forward - address by the President of Ukraine",", I wish you health, dear Ukrainians!, This week is coming to an end - a very important week for all of us, for our defense, for our steps forward, for our offensive actions. And it is time to thank all our warriors. Those who have distinguished themselves this week., The Tavria direction is the toughest. Marines of the 35th separate brigade - thank you! Paratroopers of the “Seventy-ninth” - thank you! The 130th separate reconnaissance separate battalion - thank you! The 68th separate hunting brigade - thank you! The 23rd separate mechanized brigade - thank you! Artillerymen of the 44th brigade - thank you!, I would like to especially mention the company of attack drones of the 47th separate mechanized brigade led by Chief Sergeant Rustam Mustafayev. Thank you for the result, warriors! The crew of the armored demining vehicle of the 70th separate support regiment - Senior Sergeant Mykola Nikandrov and Junior Sergeant Roman Lisin. Well done, guys!, Our National Guard - thank you all! And I would like to particularly mention Senior Sergeant Vasyl Kovylin and Platoon Commander Denys Zeleny, the 4th operational battalion, the 1st presidential brigade of the National Guard. Thank you! The guys are performing tasks in Luhansk region - near Bilohorivka., Our border guards... I would like to mention the Lutsk and Lviv border guard detachments in particular. Senior Soldier Vasyl Kutsyk, Avdiivka direction, is very effective in repelling attacks. Thank you! Sergeant Vadym Druzhyna, Siversk direction, successfully ""subtracts"" enemy soldiers and equipment. Thank you!, And of course, our defenders of the sky. Over a week, more than a hundred group air strikes on enemy positions and rear. Thank you, our pilots! Almost three dozen missiles and about fifty attack drones were destroyed in seven days. And I would like to celebrate the defenders of the Kyiv region's sky, the 96th Kyiv air defense missile brigade of the Air Force... Thank you! All ""Kalibrs"" and ""Kinzhals"" were destroyed during these attacks, and thus the lives of our people were saved., And by the way, I want to say a few things. First of all, no matter who in Russia says that our Patriots have been destroyed, they are still here, they are working, all of them are shooting down Russian missiles. As efficiently as possible. Not a single Patriot has been destroyed!, Secondly, you all saw how the visit of the delegation of African leaders and representatives went - a visit to Ukraine, and then a visit to the terrorist state. The delegation had the opportunity to see who is really interested in peace and who himself embodies war, it was very clear. Everything that was discussed in Ukraine was about the Peace Formula. Point by point. The whole content. Everything that was said in Russia was about war, about how to continue destroying lives. It is obvious that there is no alternative to the Peace Formula. It is good that the world hears and sees this more and more., Third, as for the terrorist state. Their only concern now should be how to prepare their society, Russian society, to the fact that they will lose everything they are destroying the future of their state for. Russia will lose the occupied territories. There is no and will be no alternative to our steps for de-occupation., Our troops are advancing, position by position, step by step, we are moving forward, This week, we had Ramstein, and the main thing is the speed of supply. Next week, we will have new important communications with our partners, for the sake of our movement, for the sake of weapons, for the sake of our warriors having everything they need., I am grateful to everyone who is now in combat, in positions and at combat posts! , I thank everyone who helps!, Glory to Ukraine!"
