timestamp,title,speech
30 June 2023  - 19:45 ,Ukraine and Ukrainians are much stronger than anyone thinks about us – address of President Volodymyr Zelenskyy,", Dear Ukrainians, good health to you!, I held a Supreme Commander-in-Chief's Staff meeting today – a long and very detailed one devoted to several issues. The commanders reported both on the general defense situation, and the specific directions of our defense and our offensive actions., During this day, we also have made progress in all directions of our active actions., We considered the supply of rounds for artillery – for the east, for the south - at the Staff meeting. And although our work with partners to receive rounds for Ukrainian soldiers is already at our best capacity, we will make it even more active. Strengthening our artillery is an obvious priority, and all foreign affairs specialists received additional tasks today., The situation in the north, in particular, on the territory of Belarus, was considered separately. Our intelligence reported today – Defense Intelligence, foreign intelligence, border guards intelligence. The SSU chief reported. We very carefully analyze every fact and any prospects in all directions., By the decision of the Staff, Commander-in-Chief Zaluzhny and General Naev were instructed to strengthen the northern direction – to guarantee peace. Appropriate deadlines are set., Today, I thank Denmark and personally Prime Minister Mette Frederiksen for the new defense package for Ukraine. Artillery rounds, air defense missiles, demining equipment... Thank you!, I also held several meaningful preparatory meetings today regarding the internal context in our state, relevant internal measures, and international measures – an extremely important period of foreign policy is beginning. The work in order to expand peace through expanding our security capabilities, our alliances and cooperation. The following weeks will be extremely active, and the positions of our state are clearly defined, all our officials know what to do., And one more., Today is the first anniversary of the liberation of Snake Island from the Russian invaders. It is one of our major victories. Remember, last year, in the spring, no one expected from Ukraine that we would be able to implement, in particular, this fundamental defense task – to provide security to Snake Island, and therefore to a significant part of the Black Sea water area. But our soldiers did it. Russian terrorists needed Snake Island to destroy the entire south of our country, our beautiful Odesa and other cities. Our soldiers stopped them and drove them out of Snake Island., Ukraine and Ukrainians are much stronger than anyone thinks about us. Sometimes, stronger than we are used to thinking about ourselves. Thanks to all that our people manage to do in the confrontation with Russian terrorists, we are revealing to the whole world and to ourselves a new Ukrainian strength – a real Ukrainian strength. The strength that we will never lose and that will always be a pillar of the security of the free world., I am grateful to everyone who freed Snake Island! Defense Intelligence, together with other elements of the Defense and Security Forces of our country, conducted this operation. Defense Intelligence and the SSU Alpha special unit, the Naval Forces and the army aviation of the Ground Forces Command, the Air Force aviation and our strong border guards. Thank you!, And we will always remember our heroes, our soldiers, who gave their lives for the sake of this Ukrainian victory. Among those whose names can now be mentioned... Defense Intelligence fighters – Ruslan Popov, Hero of Ukraine, captain of the 1st rank; Oleh Zaitsev, Hero of Ukraine, junior lieutenant; Vitaliy Ihnatenko, Hero of Ukraine, soldier. SSU Alpha fighters – Volodymyr Kyseliov, Hero of Ukraine, captain; Oleksandr Krykunenko, Hero of Ukraine, major. Soldiers of the Navy - Ihor Bedzai, Hero of Ukraine, colonel; as well as Mykhailo Zaremba, major; Serhiy Muschytsky, captain; Yuriy Pyroh, staff sergeant. Eternal memory!, Eternal memory and glory to all those who gave their lives so that our beautiful Ukraine would live!, Glory to Ukraine!"
29 June 2023  - 22:25 ,"Combating ecocide is one of the points of the Ukrainian Peace Formula, and we must implement each of its points - address by President Volodymyr Zelenskyy",", I wish you health, dear Ukrainians!, I am finishing the day in the Verkhovna Rada with a meeting with our Speaker Ruslan Stefanchuk. We are working., And now the report on this day, a busy day. A very long one., The European Council meeting - it is already a tradition for Ukraine to be among the members of the European Union. The agenda is obvious: our defense in this war, our path to victory, support from our partners, our security support for them, for our entire Europe. Ukraine influences the strength of Europe. This is a fact. And this year, it is time to use this and other similar facts to strengthen unity in Europe, including by starting negotiations on Ukraine's membership in the European Union., The meeting with Mike Pence, the 48th Vice President of the United States, Senator... American support for Ukraine is vital - from all Americans, every American family, all U.S. civil society, all political leaders, Congress - both parties, of course, from President Biden. Thank you for this support!, I discussed with Mr. Pence our defense, our cooperation - from the very beginning, from the very first days between the Ukrainian and American nations. We talked about weapons, about the capabilities of our soldiers, about our common values., The meeting with the members of the International Working Group on the Environmental Consequences of War - Greta Thunberg, Margot Wallström and others. We talked primarily about the Russian terrorist attack and ecocide at the Kakhovka hydroelectric power plant and the work of our group, which will deal with issues directly related to the destructive impact of Russian aggression on nature. Combating ecocide is one of the points of the Ukrainian Peace Formula, and we must implement each of its points, all aspects of peace., The conversation with the President of Guatemala. The Peace Formula, our cooperation with Latin America, assistance in demining, and most importantly, in establishing a Tribunal for Russian aggression., The meeting with our business representatives - very important, very meaningful. I am grateful to them. We discussed how to stimulate economic activity now, in times of war. We talked about how to provide more protection for business, more interaction between the state and business. The first priority now is defense, and this is obvious. But the economy is also important., I am grateful to everyone who works for Ukraine, for Ukrainians, who preserves and creates new jobs, who pays taxes and who is already preparing for our recovery, for the large-scale transformation program of Ukraine that we will definitely implement after our victory., And, of course, our warriors, our defense. Today, in my address to the Chatham House community - one of the world's leading British intellectual centers - I told that three more very important decrees have been prepared to award our warriors - 419 warriors. In total, over 49,000 Ukrainians have already been awarded state awards during the full-scale war!, I am grateful to each and every one who defends our country! I thank all those who are in combat now, who also gave us the best news today - the advancement of Ukrainian positions. Glory to you, our heroes! I thank everyone in the world who really helps us!, Glory to Ukraine!"
29 June 2023  - 22:01 ,"President Volodymyr Zelenskyy at the Chatham House 2022 Award Ceremony: This award for Ukraine is another proof that the world believes in our country, Ukrainians and our victory",", Dear friends!, I am grateful for your attention to Ukraine and your respect for Ukraine. , Ukrainian soldiers, all our beautiful people really deserve the highest honors. Millions of our people fight and work for our freedom, our common freedom – Ukrainian and all free nations. I am sure that we will keep our freedom. And your award, in particular... The Chatham House Prize for Ukraine is another proof that the world believes in Ukraine, believes in Ukrainians, believes in our victory., , Ladies and Gentlemen!, Thousands and thousands of our warriors distinguished themselves in battles against the invaders. Today, my advisors prepared three new decrees on awarding state awards to our heroes. At once to 419 of our warriors, men and women, who are fighting for freedom with their blood, pain, loss of their brothers in arms. , I want you to know that every day we have success on the frontline thanks to our heroic soldiers! And, of course, thanks to the support of our partners – and the United Kingdom is one of the obvious leaders in this support. Thank you very much!, Every day our soldiers repel Russian assaults, step by step they liberate our land and people, every day we make Russian tyranny weaker – as it should be for our world to be safe. During the full-scale war, more than 49 thousand of our soldiers are awarded with state awards for bravery in battles. 245 soldiers are awarded with the title of the Hero of Ukraine. Imagine how intense the fighting is and how strong our people are! Such a number of well-deserved awards for special bravery and courage reflects the mass bravery and courage of Ukrainians. , , Please always support our people – they deserve it. And I believe, that – the day will come very, very soon when Ukrainian contribution to the global freedom and the strength of our people will be recognized by a legitimate recognition of our state – an ally of your state and all free nations, NATO members. , We must honestly admit: peace in Europe is the Alliance. So that aggression against one or another European nation never repeats again and so that such self-sacrifice of soldiers is never needed again, security institutions, in particular Euro-Atlantic institutions, must really protect peace. And now it is real – only together with Ukraine. Which will be free, strong and, of course, in NATO. Only together with our heroes., Glory to all Ukrainian heroes! Thank you again for this day. Thank you for your support! Thank you, United Kingdom!, Слава Україні!"
29 June 2023  - 19:02 ,This is a historic time to start negotiations on Ukraine's membership in the European Union - speech by President Volodymyr Zelenskyy at the meeting of the European Council,", Dear Charles, dear colleagues!, Thank you very much, greetings to you all and thank you for inviting me!, I started this week with a visit to the frontline. Two of our regions – Donetsk and Zaporizhzhia. Most of the combat operations, both offensive and defensive, are concentrated there. The fighting is highly intensive there, and our people are outstanding heroes! Our soldiers are doing a great job, and I am proud of them, every one of them who is now on the ground, fending-off Russian attacks and destroying Russian terrorists. We manage to liberate our land and people from the occupiers, and this is the most important thing., The more successful our soldiers are now, the longer Russia will not pose a threat to Ukraine and our entire Europe. History clearly demonstrates that unsuccessful aggressions always make dictatorships weak. In fact, this is what we are seeing in Russia right now – we are seeing their weakness, which we so badly need. The weaker Russia is, and the more its bosses fear mutinies and uprisings, the more they will fear to irritate us. Russia's weakness will make it safe for others, and its defeat will solve the problem of this war., , Dear colleagues, partners!, I am grateful to all of you who’re helping our defense against Russian aggression! Thank you for every air defense system provided to us – they do save lives. It’s true. Thank you for the European initiative on a million shells and rounds for Ukraine, for our tank coalition and for all the defense packages that have been provided to our country. This is truly historic cooperation for the defense of Europe. Ukraine is grateful to Lithuania and Poland, and we will not allow Russia or its terrorist groups to even try to undermine the security of the Lithuanian and Polish people from the territory of Belarus. For Ukraine, the security of our partners is also our security. , Yesterday, Mr. President Nausėda and Mr. President Duda visited Ukraine, and we exchanged assessments of the situation in Belarus and the challenges it presents. Ukraine's position is absolutely clear – any attempt to blackmail Europe, any attempt to do something against Europe should be treated equally by the whole Europe. If someone somewhere threatens one or another European nation, it is absolutely natural to stand up for that nation and eliminate the threat., Another important thing to mention in the context of security is sanctions. I am grateful for the recently adopted eleventh sanctions package of the European Union, which continues the fair policy of pressure on everyone who makes aggression possible. It is important not to stop imposing sanctions. The fewer pauses there are, the less Russia will adapt to the pressure on it and the less it will think of ways to circumvent the sanctions. I am grateful that the eleventh sanctions package pays attention to Russia's attempts to circumvent sanctions through third countries, and this attention should be strengthened in the twelfth EU sanctions package. Many of the missiles that Russian terrorists are now using against life in Ukraine are newly produced and contain critical components made by companies in the free world. This cannot be tolerated. Together we must stop Russia's use of free world technologies for aggression against freedom., We also cannot tolerate what Russia is doing to our Zaporizhzhia nuclear power plant. Let me remind you, that – this is the largest nuclear power plant in Europe. Russian terrorists have mined it – we have specific information from our intelligence, and we have presented it, in particular, to diplomats of European countries. As well as information about Russia's use of foreign parts for missile production. The Russian nuclear industry deserves sanctions in response to Russian radiation blackmail., , Dear colleagues!, Tomorrow, the Swedish presidency comes to an end, and I would like to thank Sweden and personally Prime Minister Kristersson for their effective work. Over these six months, Europe has become stronger. I’m sure of it. On behalf of all Ukrainians, I want to thank you, dear leaders, and you, Charles, you, Ursula, you, Roberta, for making important economic and political decisions that help us defend our freedom and Europe., Unfortunately, there are things that do not help us. But, if solidarity continues to work, if our security and economic cooperation is not broken by artificial and illegal restrictions, if Europe's long-term and principled decisions continue to send signals to the world that Europe believes in peace, then this war will definitely not drag on., I am grateful for the extension of our free trade with Europe and transit for another year. Every manifestation of solidarity, every manifestation of unity is now lifesaving. I am grateful for the proposal of a long-term financial instrument of the EU in the amount of 50 billion euros announced by the President of the European Commission von der Leyen, and if this proposal is approved, it will be the right signal that Europe believes in peace, believes in Ukraine. It is very important that the European Parliament always gives principled assessments of what is happening, and immediately condemned the Russian terrorist attack on the Kakhovka hydroelectric power plant. This attack led to the largest ecocide in Europe in decades, and those responsible must be held accountable. It is important that the European Council also condemn this horrific Russian terrorist attack and ecocide at the Kakhovka hydroelectric power plant. , I would like to note that if there is no strong reaction from European leaders and countries to the Russian crime at the Kakhovka HPP, it may give Russian terrorists more arrogance with regard to the Zaporizhzhia NPP. And, in any case, it is destructive when Russia uses a nuclear power plant for radiation blackmail and at the same time discusses the construction of new nuclear units with EU member states. How can we trust a terrorist to build nuclear units? Sorry, but it’s a rhetorical question., And finally, a few thoughts on the next six months for Europe. , I believe it is symbolic that this Saturday, on the first day of Spain's presidency, Mr. Sanchez, the Prime Minister of Spain, will visit Ukraine at my invitation. For the first time, the beginning of a country's presidency will be emphasized by a visit to Ukraine. And this actually says a lot about how important the next six months will be for our Europe. This is a historic time to start negotiations on Ukraine's membership in the EU. A Europe of values, a free and strong Europe, a Europe of peace is unthinkable without Ukraine. We are ready to start accession negotiations, and our progress in implementing the European Commission's recommendations has to be fixed. Ukraine is determined to be fully prepared for the start of accession negotiations as soon as possible, and we will do so., Peace has no alternatives. So, maximum unity in Europe has no alternatives., Thank you very much for your attention! Thank you for your support, friends!, Слава Україні!"
28 June 2023  - 22:49 ,Russia and its accomplices must feel that the price of their terror will only increase for them - address by the President of Ukraine,", Dear Ukrainians!, First of all, regarding yesterday's Russian attack on Kramatorsk. Today, work continued all day at the site of the attack. Unfortunately, the death toll has increased. Russian missiles claimed the lives of 11 of our people, including three children. My condolences to the families. More than 60 people were injured and wounded., Today, the Security Service of Ukraine together with the police special forces detained the person who coordinated this terrorist attack. They hit an ordinary cafe in Kramatorsk, a popular pizzeria. Neighboring houses, shops, and a gas station were damaged. An ordinary city, an ordinary life. There may still be people under the rubble., Everyone who helps Russian terrorists destroy life deserves the maximum punishment. And this applies not only to some collaborators. Everything is clear about them. These are people without humanity. Anyone in the world who does not understand that one cannot be an accomplice of a terrorist state must be held accountable by the entire international community. The spotter is being charged with treason. The possible punishment is life imprisonment. Accomplices of a terrorist state must be treated as betrayers of humanity., We will continue our work to strengthen international sanctions against Russia and its accomplices. They must feel that the price of their terror will only increase for them. And we will continue our global legal work to ensure that international instruments work in one way or another to punish all Russian terrorists and the aggressor state itself., Today, in my address to the Verkhovna Rada of Ukraine on the occasion of Constitution Day, I spoke, in particular, about justice. I spoke about internal justice, which is about accountability for violations of law in Ukraine. And about justice in relation to the Russian-Ukrainian war - about Russia's accountability for war crimes. The policy of justice will be one of the foundations of the Ukrainian Doctrine, a fundamental document that will determine the course of our country for decades., We need such a document. Everyone in Ukraine, all our neighbors, everyone in the world should know what our national goal is, what we consider to be the end of this war, and how we are going to live after this war. No matter what the occupiers try to do against us and no matter what kind of terror they use, they will not be able to break Ukraine. They will not succeed in knocking us off the path that leads the occupiers to accountability for everything they have done against us and that leads us to our guaranteed security and lasting freedom., Ukraine and everyone in the world who stands with us in defense of freedom will also stand in defense of justice. Justice for all those whose lives were taken by Russian terror, whose fate was broken by the Russian war. Eternal memory to all our people, to all Ukrainian children who were killed by Russian savages!, I would like to briefly report on the day., The Presidents of Lithuania and Poland, Gitanas Nausėda and Andrzej Duda, paid a visit., A very timely and useful visit on the eve of Vilnius. The format of the talks was both joint and bilateral. Weapons for Ukraine. By the way, thank you, Gitanas, Mr. President, for the decision to purchase and transfer NASAMS systems to Ukraine, as it is very much needed. We discussed common political challenges in the entire region and between our countries. Of course, we also talked about the launch of negotiations on Ukraine's membership in the European Union, which we expect to happen this year., I met with Chief Master Sergeant of the 47th separate mechanized brigade ""Magura"" Valerii Markus. We talked about the war, our warriors, and our defense., We also discussed the reform of record keeping in military structures. Less paperwork and bureaucracy, more digitalization. We discussed the reform of the sergeant corps. It was a good conversation. Thank you for the chevrons!, Today, on the Constitution Day of Ukraine, I had the honor to award our warriors and hand over state awards to the families of our heroes. It was very emotional, very honorable. I am proud of our warriors! I am grateful for everything and for the saved life of Ukraine!, Congratulations to everyone on Constitution Day and, most importantly, I wish us all, each and every one in our country, to multiply freedom, glory and independence of Ukraine! And so it will be!, I also congratulate all Muslims of Ukraine and the world on the beginning of Kurban Bayram. May we all achieve peace for our country, for our countries, for our children. A fair and just peace., I thank everyone who is fighting and working for Ukraine! I am grateful to each and every one who is now in combat, at combat posts and in positions. Thank you, warriors, for your new advancement!, Glory to Ukraine!"
