timestamp,title,speech
27 June 2023  - 23:11 ,Every manifestation of terror proves to the whole world that Russia deserves only defeat and a tribunal - address by the President of Ukraine,", Fellow Ukrainians!, Exactly on the anniversary of the Russian terrorists' attack on Kremenchuk, on the shopping mall, when 22 people were killed, Russian savages again fired missiles at the Kremenchuk district., Today, Russian terrorists also brutally shelled Kramatorsk. S-300 missiles. Three people were killed, including a child. My condolences to the families and friends. As of this hour, more than 40 people are wounded. Assistance is being provided to all. The rubble is being cleared., Each such manifestation of terror proves over and over again to us and to the whole world that Russia deserves only one thing as a result of everything it has done - defeat and a tribunal, fair and legal trials against all Russian murderers and terrorists., And I thank again and again everyone in the world who supports Ukraine and helps protect our people!, Today we have a new defense package from the United States for our warriors. Armored vehicles and ammunition for Patriots, Stingers and HIMARS. Additional shells for our artillery. I thank Mr. President Biden, the Congress, both parties, and all Americans!, I spoke with Mr. Prime Minister of Norway. I thanked him for the support provided - defense, economic, and political. It is very significant! I informed him about my trip yesterday to the frontline, to our warriors, about our current defense capabilities. I voiced some of our military needs. We also discussed the creation of a fighter jet coalition. A separate topic in the conversation was the upcoming NATO Summit in Vilnius. I am grateful to Norway for its understanding!, Today, I also held a special meeting with our international experts - the Office and the government - to discuss preparations for the Vilnius Summit. I am confident that the decisions of the summit can be positive for Ukraine! We are doing everything possible for this and have engaged all of Ukraine's international capabilities., And, of course, the frontline. Our heroes, our active actions. Today, we also have advancement! In all directions where we are conducting offensive operations. Thank you, warriors! Today we have important results in repelling Russian assaults. I am very grateful to you!, Today, I would like to pay special tribute to the glorious 3rd separate assault brigade, the strong 28th separate mechanized brigade, the heroic 54th separate mechanized brigade and the tough 57th separate motorized infantry brigade. I thank all of you, warriors! Well done!, Thank you for every occupier destroyed and every Ukrainian life saved!, Glory to our heroes! Thank you to everyone in the world who is not afraid of Russian terrorists and is restoring security in the world together with us!, Glory to Ukraine!"
27 June 2023  - 00:30 ,"Today, our warriors have advanced in all directions, and this is a happy day - address by the President of Ukraine",", Good health to you, fellow Ukrainians!, Today - the front. Donetsk region, Zaporizhzhia. Our warriors, our frontline positions, areas of active operations at the front. Today, our warriors have advanced in all directions, and this is a happy day. I wished the guys more days like this., I paid a visit to the Khortytsia units that distinguished themselves heroically in the Battle of Bakhmut. Well done, warriors! Then our marines - very powerful, very accurate. Thank you for doing your best to save the lives of our warriors. Then Tavria, the south, the front. It was a busy day, a lot of emotions... I was honored to award our warriors, to thank them personally, to shake their hands. Thank you for all your words of support, guys! Thank you for your hugs, very warm ones, to everyone today. And thank you for your chevrons - it is extremely honorable for me, and I will tell about each chevron separately. All our warriors - from soldiers to sailors to generals - are doing a great job!, I presented two Gold Stars of the Hero of Ukraine – to Captain Oleh Olyva, commander of the airmobile company of the 81st separate airborne assault brigade, and Major Serhiy Dudin, deputy commander of the marine battalion of the 35th separate brigade. Indeed, they are great people, thank you!, Meetings with generals... Zubanych, Tarnavskyi, Sodol, Syrskyi. Several operational decisions were made. Once again, we discussed the creation of the Marine Corps, all the details are clear, absolutely clear - organization, training, supply... We are strengthening the Marines and all elements of our Defense Forces, it is a must., Yesterday, I had talks with partners, including President Biden, primarily about arms supplies. , Today, I was in the area where these weapons will give more power, more protection to Ukrainians' lives. And bring our victory closer, this is the main thing. All our land will be free - all of it., I thank everyone who is now fighting for Ukraine, who is preparing for combat, who is on combat missions, who is at combat posts... All those who are recovering from injuries... All those who are training our warriors! Thank you all! I am proud of all of you! Glory to you, our heroes!, And eternal blessed memory to all those who gave their lives for Ukraine, each and every one of them!, Glory to Ukraine!"
25 June 2023  - 23:12 ,"The longer the Russian aggression lasts, the more degradation it causes in Russia itself – address by the President of Ukraine",", Good health to you, fellow Ukrainians!, I have just completed a series of international conversations – with President of the United States Biden, with Prime Minister of Canada Trudeau, and with President of Poland Andrzej Duda. Positive conversations that are very necessary right now for all of us., First. Of course, we discussed the hostilities on the frontline, our active actions. I thanked our partners for the support provided – it is very significant and really helps our soldiers move forward. Now the Russian occupiers are suffering losses, which we need. Each of their losses is a long-term strengthening of freedom., We also discussed further strengthening of Ukrainian troops, and I thank our partners for understanding our needs – long-range needs. I am especially grateful to President Biden and the United States for the reliability of Patriots. We discussed the strengthening of our artillery, MLRS and other things., Second. The situation at the Zaporizhzhia nuclear power plant. Unfortunately, the world's attention to the existing Russian threat at the Zaporizhzhia NPP is still insufficient. Just as the reaction to the Russian blowing up of the Kakhovka hydroelectric power plant and the deliberate attempt by Russian terrorists to hit the dam of another reservoir in Kryvyi Rih was insufficient., I shared with our partners the information we have, the information from our intelligence, about the Russian scenario of mining the Zaporizhzhia NPP, which has obviously been approved for terrorists. We must take very specific steps – all together in the world – to prevent any radiation accidents., Third. The longer Russian aggression lasts, the more degradation it causes in Russia itself. One of the manifestations of this degradation is that Russian aggression is gradually returning to its home harbor. In our conversations with the leaders, we have exchanged our assessments of what is happening in Russia. We see the situation in the same way and know how to respond. , And one more thing. Very important meetings took place today in Copenhagen. The format of political advisors. The Office's team – Andriy Yermak, Andriy Sybiha, and Ihor Zhovkva – met with political advisors to the leaders of Türkiye, India, Japan, South Africa, and the European Union institutions. We are bringing the implementation of the Peace Formula closer, and for this purpose we involve the widest possible range of partners. Relations with the European Union remain a top priority, and every week we are laying the basis for full membership., With just 15 days to go until the NATO Summit in Vilnius, we are doing everything to ensure that the summit has real content. Strong content. Positive decisions for Ukraine in Vilnius are the only possible positive decisions for our common security in Europe and in the Alliance as a whole., Thank you to everyone who supports Ukraine! Thank you to Mr. President Biden, the Congress, both parties and all Americans for the historic strengthening of freedom in the world! Thank you to Mr. Prime Minister Trudeau and all Canadians for your unwavering support! Thank you to Mr. President Duda and everyone in Poland who stands with Ukraine in the defense of Europe!, Glory to our warriors! Glory to every brigade that is now moving forward at the front... Tavria direction – you are doing a great job! Thank you!, Glory to Ukraine!"
25 June 2023  - 11:17 ,"It is right for our people, our children to know to whom we owe our lives and freedom of Ukraine - President Volodymyr Zelenskyy’s address",", Fellow Ukrainians!, I would like to dedicate this address primarily to our warriors. To all those who are fighting in the most difficult battles, to all those who are leading this war to Ukraine's victory., Of course, I'll focus on the Tavria units - the ones that did the biggest amount of work at the front this week., Marines of the 35th and 36th separate brigades. Thank you, guys! The 110th separate mechanized brigade named after Brigadier General Marko Bezruchko. Thank you, warriors! Artillerymen of the 55th Zaporizhzhia Sich brigade. I am proud of you, and it is an honor for me every time to celebrate you, our heroes! Paratroopers of the 79th separate brigade - again and again I thank you guys for your extraordinary strength! The 128th separate mountain assault brigade of Zakarpattia... Thank you, warriors! Thank you for each of your results for Ukraine!, Today I would like to personally recognize Senior Lieutenant Ivan Hrysiuk, Junior Sergeant Mykola Komisar and Soldier Volodymyr Kononuchenko. Thank you for your strength and precision!, Our border guards. The Kramatorsk, Lviv and Donetsk border guard detachments and the troops of the Dozor mobile border guard detachment. I thank all of you! And I would like to especially mention Senior Sergeant Oleksandr Koprovsky from the air reconnaissance group, Senior Soldier Viktor Polishchuk, and Soldier Roman Borys. Thank you, guys!, Our National Guard. The 4th operational brigade of the National Guard. It is fighting in Donetsk region. Thank you, warriors! In particular, I would like to mention the aerial reconnaissance men - Senior Soldier Oleksandr Pohorenyi and Soldier Maksym Bobruyenko. Your skills, guys, are very helpful!, And I would like all our people, each and every one in Ukraine, to thank our warriors in this way - personally. To your family and friends who are at the front. To your acquaintances. To those you have heard about. Those you follow on social media. Those whose families you know. Please thank, support and tell your friends, your children and people around the world about our warriors. Our warriors deserve it. They are real heroes., And one more thing., From time to time my son comes to my office. From time to time, but nevertheless. And he is most interested here in these chevrons. Military personnel, volunteers, relatives of our soldiers handed them to me. At the front and in Kyiv, in hospitals, during the award ceremonies for heroes in the Mariyinsky Palace. The number of chevrons on the chevron board is growing, but very slowly, as every time Kyrylo takes them away. And I am happy that he is interested in this. Our heroes, our defense, Ukrainian chevrons., A long time ago I wanted to make a special series of posts in my social networks about these chevrons. About where they came from. Who gave them to me. What these units are. And today, we will start issuing such posts., Maybe someone else wants to talk about the chevrons you have. I think that it is right. It is right for our people, our children to know to whom we owe our lives and Ukraine’s freedom. Thank you, warriors! Thank you to everyone who fights and works for Ukraine!, Glory to Ukraine!"
24 June 2023  - 20:10 ,"Ukraine will definitely be able to protect Europe from any Russian forces, and it doesn't matter who commands them – address of President Volodymyr Zelenskyy",", Dear Ukrainians, all the people of the world, good health to you!, Today is a day when there definitely should be no silence. And we definitely need leadership., Today the world saw that the bosses of Russia do not control anything. Nothing at all. Complete chaos. Complete absence of any predictability. And it is happening on Russian territory, which is fully loaded with weapons., We all remember how the head of Russia threatened the world in 2021. He had some ultimatums, he was trying to show a kind of strength..., The year 2022 showed that he confused – confused his illusions and the lies he was fed with strength. They in the Kremlin are capable of resorting to any terror, capable of resorting to any stupidity, but they cannot provide even one percent of the necessary control. And they are the real problem., In one day, they lost several of their million-plus cities and showed all Russian bandits, mercenaries, oligarchs and anyone else how easy it is to capture Russian cities and, probably, arsenals with weapons., Now, it is very important that no one in the world remains silent because of being afraid of this Russian chaos. All the actions of the leaders now can be historic. Every word of journalists is worth its weight in gold. It is necessary to clearly name the source of the problem. And if someone in the world tries to ignore the situation, if someone in the world is under the illusion that the Kremlin is capable of regaining control... this only postpones the problem until the next breakthrough of chaos – even more dangerous., We all know the solution., First, the world should not be afraid. We know that only our unity protects us., Ukraine will definitely be able to protect Europe from any Russian forces, and it doesn't matter who commands them. We will protect. The security of Europe's eastern flank depends only on our defense. And that is why every manifestation of support for our defense is support for your defense, everyone in the free world., Ukrainian soldiers, Ukrainian guns, Ukrainian tanks, Ukrainian missiles are all that protect Europe from such marches as we see today on Russian territory. And when we ask to give us the F-16 fighters or the ATACMS, we're enhancing our common defense. Real defense. This is what is needed. Now is the time to provide all the weapons necessary for defense., Second, everything must be real. It's time for everyone in the world to frankly say that all of Russia's criminal actions against Ukraine were and are unprovoked. And we all have to focus exclusively on our common security priorities. NATO is not just a word or a set of formal promises. These are reliable guarantees for everyone that peace won't be destroyed. Without Ukraine, such guarantees are worthless. Already in July at the summit in Vilnius, it is a historic chance for real decisions without looking back at Russia. Any nation that borders Russia really supports this., And the third... I will say it in Russian. The man from the Kremlin is obviously very afraid and probably hiding somewhere, not showing himself. I am sure that he is no longer in Moscow. He calls somewhere, and asks something... He knows what he is afraid of because he himself created this threat. All evil, all losses, all hatred – he himself who spreads it. And the longer he can run between his bunkers, the more you all will lose... all who are connected with Russia., What will we, Ukrainians, do?, We will defend our country. We will defend our freedom. We will not be silent and we will not be inactive. We know how to win – and it will happen. Our victory in this war will definitely be., And what will you do?, The longer your troops stay on Ukrainian land, the more devastation they will bring to Russia. The longer this person is in the Kremlin, the more disasters there will be., And now I'm switching to my native language., Thanks to our soldiers! Thanks to everyone who is now beating the occupiers! Thanks to the Air Force for protecting our skies!, Glory to Ukraine!, We will defeat everyone!"
23 June 2023  - 19:39 ,May Ukraine's victory and state institutions' successful transformation be best tribute to memory of all our heroes – address of President Volodymyr Zelenskyy,", Dear Ukrainians, I wish you health!, The summary of this busy day., The meeting based on the results of the London Ukraine Recovery Conference is a powerful event, good gains for our country. The support from the United Kingdom, the United States, and the European Union is crucial. Long-term support programs for the future, for years to come. About five hundred global companies, strong companies, are interested in investing in Ukraine. Clear support for Ukraine's EU membership: we are already perceived as an EU member politically. Separately, we are working on the mechanism for the confiscation of the assets of the terrorist state and its associated persons. I thank everyone who prepared the conference and participated in its work, it is really important., A very meaningful meeting of the National Security and Defense Council today. I have already reported on it separately. I just held a Supreme Commander-in-Chief's Staff meeting. Justice is also a very important point of our discussion at the Staff meeting. Issues concerning military commission chiefs, in particular the scandal with... a figure in Odesa. This person should definitely not be in the recruitment system of the Armed Forces, it is very unpleasant, frankly immoral, and wrong that this person remained in his position despite everything. I've instructed Commander-in-Chief Zaluzhny to remove this person from his post. And First Deputy Minister of Defense of Ukraine Pavliuk has been instructed to organize an inspection of this entire system of military commissions. It is a pity that the Staff meeting's attention and time now have to be spent on such issues., Of course, the situation on the front line was discussed in great detail – all the main directions, ammunition supply, artillery... Everything that requires the Staff's attention today. Commanders – Generals Zaluzhny, Syrsky, Tarnavsky, Moskalyov, Vice-Admiral Neizhpapa, General Malyuk, and government officials reported to the meeting. All., I had the honor to congratulate the officers of our military educational institutions on their graduation... Six higher education institutions at once. Kharkiv National University of the Air Force, Military Institute of Tank Troops of Kharkiv Polytechnic Institute, Military Institute of Taras Shevchenko National University of Kyiv, Kruty Heroes Military Institute of Telecommunications and Informatization, Ukrainian Military Medical Academy and the Department of Military Training of the National University of Life and Environmental Sciences of Ukraine. I thank each and every one who chooses to be a Ukrainian officer, and I wish for two absolutely fundamental things: to destroy the occupiers as much as possible and win as soon as possible., And two more things., Today, the Civil Service Day is celebrated in our country. The day of those people without whose integrity there is no effective state. Of course, we still have a lot to do so that the civil service in Ukraine gets closer to the models we are aiming for in our policy. But now I want to thank all our people who, under the existing conditions and with the available resources in the state, are doing everything that depends on them to make the state effective. Thank you! To each and every one! And I congratulate you on the Civil Service Day of Ukraine., And, of course, the front. Knowing our heroes, and being grateful to them is a must., Today, I would like to pay particular attention to the soldiers of our 35th Separate Marine Brigade. A brigade that performs extremely difficult tasks. Guys who fight exactly the way Ukrainian soldiers should fight. Senior sailor Viacheslav Imanhulov and junior lieutenant Serhiy Penov – thank you, guys, for your exemplary strength and courage in the battles in Donetsk region. That's what our soldiers, Ukrainian soldiers, need to be. Well done!, And I ask each and every one: please honor the memory of our two paratroopers of the 35th Brigade. Especially brave, especially strong. They gave their lives for our state, for our people right now – in the battles in June, and Ukraine must remember them. Captain Ivan Kotsur... Eternal memory! Senior Lieutenant Oleksandr Kazandzhi... Eternal memory! May Ukraine's victory in this war and the successful transformation of our state institutions into ones as strong and effective as our soldiers are – may this be the best tribute to the memory of all our heroes of different times who fought and died for Ukraine's freedom and strength!, Glory to Ukraine!"
23 June 2023  - 16:45 ,Security is the first priority - address by the President of Ukraine following the NSDC meeting,", I wish you health, fellow Ukrainians!, I held the NSDC meeting. Three issues on the agenda. Most importantly, Ministers Klymenko and Kamyshin presented the first summary of the inspection of shelters in the regions of our country: Klymenko - across the country, Kamyshin - for Kyiv. In general, today we reviewed the situation with shelters in the regions, districts and cities most intensively terrorized by the enemy., The results are poor. Almost all over the country. This includes Kyiv, Zaporizhzhia, Kharkiv, Dnipro, Konotop, Bila Tserkva, and many other cities. The situation is particularly cynical and shameful in those cities that have significant financial resources but, unfortunately, other priorities. There will be personnel decisions., Accessible and reliable shelters across the country should be and will be a priority for leaders at all levels. Security is the first priority., The Prosecutor General informed the NSDC about the legal action taken by the prosecutor's office to return the premises of the shelters that were illegally withdrawn from the ownership of the communities. To date, more than 400 such lawsuits have been filed across the country, and the work continues., Prime Minister Shmyhal also reported on the difficult situation with bridges and bridge crossings. The largest cities, including Kyiv. The situation is downright dangerous. The National Security and Defense Council has decided to set up a commission to inspect all bridges and overpasses across the country. Deputy Prime Minister Kubrakov is responsible for the inspection., , The second point on the agenda is courts., Deputy Prime Minister Stefanishyna informed the NSDC of the European Commission's interim verbal assessment of our institutional progress, particularly with regard to judicial reform., Indeed, a lot has been done. But we consider this only as a necessary basis for our own obligations to Ukrainians in terms of justice. Obviously, the case of the former President of the Supreme Court and other similar situations in the judicial system require a stricter state policy regarding the requirements for judges, for all those who work in the justice system, and their accountability for violations. For corruption violations., The Verkhovna Rada of Ukraine appealed to the National Security and Defense Council. Today we considered the appeal. The Chairman of the Verkhovna Rada, Ruslan Stefanchuk, and the Chairman of the Parliamentary Committee on Legal Policy, Mr. Maslov, delivered reports., So, here are the proposals. To increase criminal liability for corruption offenses in the judiciary. And to make it tangible. From 10 to 15 years with confiscation of property. And this should apply to those who extort money, who take money, who maintain this system of corruption at all its levels., Next. There should be integrity checks of judges. And not only before appointment. Time can, unfortunately, change people about whom there was a positive conclusion at the beginning of their work in the courts. And I believe that it is worth checking, including with the use of a polygraph., Very importantly, we need to strengthen the role of the jury and expand the number of cases of its use in Ukraine. This is not only about democracy, it is about ensuring more justice., We also discussed the issue of protecting the rights of business and investors in courts. This is a fundamental task. A strong economy means secured investments and guaranteed protection of property rights. And it should be ensured. If we need a separate mechanism to protect business and investors' rights, we must ensure it. We have relevant proposals., Of course, we discussed the tasks that must be completed by the end of the year in order to fully implement each of the European Commission's recommendations for the start of negotiations on joining the European Union. The National Security and Defense Council gave the necessary protocol instructions in each of these areas. I am confident that all of them can be fulfilled., Today is exactly one year since Ukraine has become a candidate for accession to the European Union, and this year the goal is to start membership negotiations. Ukraine will definitely do its part., Glory to Ukraine!"
