timestamp,title,speech
9 June 2023  - 20:02 ,"We see heroism of our soldiers and are grateful for every minute of their life, which is the life of Ukraine – address of President Volodymyr Zelenskyy",", Dear Ukrainians, I wish you health!, I just held a meeting of the Staff of the Supreme Commander-in-Chief. The situation on the front line is the main focus. Reports from commanders of task forces, the Commander-in-Chief, Defense Intelligence, Ministry of Defense, Ministry of Strategic Industries, Ministry of Internal Affairs., We focus our attention on all directions where our actions are needed and where the enemy may suffer certain defeats. Our defensive actions, active actions, our gains on the front lines., We discussed in detail the supply and distribution of ammunition, the strengthening of our artillery, and anti-aircraft defense., I spoke today with the Prime Ministers of Japan and the Netherlands., I briefed them on our rescue operation in the southern regions, about our urgent needs. There is a willingness to help Ukraine, and I am grateful to the partners for this. There are decisions regarding humanitarian support packages., With the Prime Minister of Japan, we discussed preparations for the Global Peace Summit and a conference in Japan on the reconstruction and transformation of our country after hostilities., We talked with the Prime Minister of the Netherlands about our further defense cooperation, coordinated our positions before the next Ramstein meeting. We are moving step by step in strengthening our air shield. We discussed the coalition of Patriot systems, the training of our pilots., Today, there is a very important decision of the Supreme Court of the Netherlands regarding the Scythian gold collection. The Ukrainian collection. The collection kept in our Crimea, but which cannot yet be returned to Crimea for an obvious reason: it cannot be given to the occupier, the robber., Of course, it will be in Crimea, when the Ukrainian flag will also be in Crimea., Actually, the highest court of the Netherlands confirmed this logic. And this is another proof that the Dutch people, the Dutch society and the state really know how to be leaders in defending the rule of law and the values of civilization., I thank everyone who fought for this decision, our team at the Ministry of Justice that worked for this result. We will protect justice step by step., Today, there is also a new security support package from the United States for over $2 billion. Missiles for Patriots and other air defense systems, strengthening our defenses on the ground, enhancing the strength of all our soldiers. Thank you, Mr. President Biden, thank you to both parties of Congress and to all Americans who want freedom to win as much as Ukrainians do., Of course, during the day I receive reports about the rescue operation in Kherson region and Mykolaiv region, about the state of the Kakhovka reservoir – in fact, its remains., An enormous amount of challenges. But we are working to overcome them at all possible levels. And the main thing is that now there is a public potential to do it., Caring for each other, working in unity, protecting people and life. These are our principles, the principles of struggling Ukraine. They, our principles, are now 100 percent effective. And I am sure: no matter how difficult it may be, we will overcome the consequences of this disaster and all Russian evil., I thank everyone in the world who is already helping and who is asking Ukraine how to help. I'm thankful to everyone who is already participating in the rescue operation, who is helping people as best they can. Help people, animals, all living things. I also thank all those who encourage international organizations, foreign leaders, and other states to see what happened and call things by their names. Russian terrorists must be held accountable for everything they have done., And separately – for our soldiers, for all those who are in particularly tough battles these days., We see your heroism, and we are grateful to you for every minute of your life – a life that is truly the life of Ukraine. Because Ukraine is as free as you, our soldiers, are strong. Ukraine is defended as much as you, our soldiers, are effective., Everyone who is fighting now is a fighting Ukraine. Thank you for this! Glory to all who fight and work for our country!, Glory to Ukraine!"
9 June 2023  - 00:32 ,Russia is ruled by savages who themselves are the biggest disaster on the planet - address by the President of Ukraine,", Fellow Ukrainians!, Today was a very long, hard day. Kherson and the region, Mykolaiv region, cities and communities of our Dnipropetrovsk region. Conversations, meetings, evacuation centers, an international appeal., First. We are working at all levels of state and local authorities to rescue as many people as possible from the flooded areas. The evacuation is ongoing. Wherever we can get people out of the flood zone, we do so. The State Emergency Service, police and military are doing a great job! I want to thank each and every one of you who are involved!, Second. There is a presence of international organizations on our free territory, and concrete assistance. In particular, it is the Ukrainian Red Cross and many others. I am grateful to every organization, every volunteer, every company that has really joined the rescue operation., And it is obvious that the absence of some international organizations, such as the International Red Cross, in the disaster zone in the occupied territory, the absence of their assistance to our people in the occupied territory is wrong and is simply self-destruction for such organizations to my mind., Third. Russian terrorists are trying to further aggravate the situation they have caused with their ecocide. This is absolutely deliberate. They continue to shell Kherson and the communities of the region, which have already been flooded by terrorists. They are even shelling evacuation points, which is a manifestation of evil that perhaps no terrorists in the world, except for Russian ones, have ever done., The occupiers have completely abandoned people on the left bank of Kherson region to their fate. The catastrophe has been expanding there for two days now. And this is also an absolutely conscious choice of the Russian leadership. There is no one left in the world today who does not see that Russia is ruled by savages. Savages who themselves are the biggest disaster on the planet today., Together with our partners, we must do everything for the world to prove that it can cope with such disasters, with such terrorists., The situation with drinking water in our cities and communities. Leaders on the ground and in the government know the drill. We have solutions, resources and funds. We will do everything to provide people with drinking water despite this disaster. There may be inconvenience, but we will do everything. Today, I held a separate meeting on water supply and safety of people in the cities and communities of Dnipropetrovsk region - I was there personally. Kryvyi Rih, Marhanets, Nikopol, Pokrov and other communities - we talked about it., The situation with infrastructure and environmental damage. The damage caused by the Russian act of terrorism is very significant, this is clear to everyone. But it should also be clear that there are no alternatives other than maximum recovery and maximum reconstruction. It may be Russia that will be left devastated after Putin, but not Ukraine., And one more thing. Mandatory. Security. I am in constant communication with our military. The commanders of Khortytsia, Tavria, all those involved in the hottest areas. Donetsk region - very tough battles. But there is a result, and I am grateful to everyone who ensures this result! Bakhmut - well done. Step by step. I thank each of our warriors! Avdiivka, Maryinka, the entire east, the situation in the south, the situation after the Russians blew up the dam of our native Kakhovka - we see every detail. But it's not time to talk about it today., Thank you to our people!, Glory to Ukraine!"
8 June 2023  - 21:20 ,It is necessary to consolidate the world for Russia to bear responsibility for ecocide and for Ukraine not to be left alone with this tragedy - President's address to the representatives of the world environmental protection community,", Good evening!, Greetings to all of you!, All of you who did not remain indifferent when you saw this man-made disaster at the Kakhovka hydroelectric power plant., This is not a natural disaster, not a manifestation of the climate crisis. This disaster is Putin. What he does. What he personally orders to do., The situation is extremely difficult. Russian troops do not stop artillery strikes at the very territory where people are being evacuated. Unfortunately, there are wounded from these terrorist attacks. People who are rescuing and evacuating from the Russian ecocide are also forced to flee from Russian fire! Right at the evacuation points... This Russian crime of ecocide is the largest in Europe in decades, but apparently, the Russian occupiers have decided to further aggravate its consequences., In the occupied part of the territory, where about a dozen settlements are flooded, no evacuation is carried out at all. People have been staying on rooftops, trapped in water for two days, without drinking water, without food or medical care. We do not know the number of dead and injured yet., , Literally every hour we are establishing more and more details about the damage Russia has caused by this disaster. In more than thirty settlements, life is ruined. For hundreds of thousands of people in many towns and villages, access to drinking water has been greatly impeded. Due to the destruction of the dam, fuel storages, warehouses with chemicals, warehouses with fertilizers, animal burial grounds, including at least two ""anthrax burials"" - both in the temporarily occupied territory - were flooded. We do not know what happened to them now. Where there was no centralized sewage system, sewage is already in the water that covers everything..., The number of ecosystems that have been destroyed or pushed to the brink of extinction by this Russian terrorist act is already measured in thousands. More than fifty thousand hectares of forests have been flooded, and at least half of them will die. Tens of thousands of birds and at least twenty thousand wild animals are at risk of death. Obviously, the Kakhovka reservoir has been turned into a large grave for millions of living beings., No nation should be left to face such challenges alone! But there is no answer yet to how we can overcome all this together., First. Of course, we will continue to do everything possible to save as many people as possible. And we need the world's support in this. And not just with rhetoric, but with actions., International organizations have started to help on the territory we control. I am grateful. On the occupied territory, there is zero support. And the longer this goes on, the more victims there will be, unfortunately., There is virtually no attention of international organizations to the occupied territory, which is flooded. And we need, in particular, your pressure on them! Please!, Second. All this we have faced is a deliberate crime of the occupier. There are many questions about what happened. But it happened in the occupied territory. But last year we warned about the occupiers mining the dam and other structures of the plant. But Russian troops are now shelling the areas where the evacuation is underway. Obviously, it is Russia that is interested in the disaster., Just as we have established special Expert Groups to promote sanctions and security guarantees for Ukraine, we are establishing an Expert Group that will primarily focus on consolidating the world so that Russia is fully responsible for the ecocide and so that our country is not left alone with this tragedy - the ecocide. I am sure that with sufficient leadership in the world, the appropriate tools can be created., Third. Any terrorist counts on only a few forms of results for himself: the suffering of people, the intimidation of people, and the ruins that terror leaves behind. This is exactly how Russia is acting in this case as well., , Of course, we will do everything to guarantee people a basis for life even after this disaster. But we need to make sure that there is not a single desert or ruin or dead zone left after this disaster. And this can only be ensured by joint efforts, together with the global environmental protection community, together with policy makers, together with leaders and states, together with international organizations., Pollution and poison from the flooded area quickly gets into the groundwater, poisons the rivers, and from there it enters the Black Sea basin. That is, there is no destruction of nature ""somewhere out there"" – everything in the world is very interconnected., So please spread the truth about this Russian ecocide. Please urge leaders, states and international organizations to act. It is no coincidence that one of the key points in our proposed Peace Formula is to combat ecocide. Please, let's work together to make sure that there are no more ecocides. Join our community, which I mentioned, our platform, our specialists. We are in constant touch., Thank you for your attention!, Glory to Ukraine!"
7 June 2023  - 22:41 ,"International organizations, such as the ICRC, must immediately join the rescue of people in the occupied part of Kherson region – address by the President of Ukraine",", Fellow Ukrainians!, Today, maximum attention is paid to the consequences of the Russian act of terrorism at the Kakhovka hydroelectric power plant. Dozens of settlements on the territory under our control have been flooded. Thousands of houses!, Evacuation continues. Under fire! Russian artillery continues to fire, no matter what. Savages., But as of now, more than 2,000 people have been rescued in Kherson and Mykolaiv regions. And I thank everyone involved in this work, everyone who helps! Our task is to protect lives and help people as much as possible., The situation in the occupied part of Kherson region is absolutely catastrophic. The occupiers simply abandoned people in these terrible conditions. Without rescue, without water, just on the rooftops in flooded communities. And this is another deliberate crime of Russia: after the terrorist state has caused a disaster, it also maximizes the damage from it., Now we need a clear and quick response from the world to what is happening. It is even impossible to establish for sure how many people in the temporarily occupied territory of Kherson region may die without rescue, without drinking water, without food, without medical care. Our military and special services are rescuing people as much as it is possible, despite the shelling. , But large-scale efforts are needed. We need international organizations, such as the International Committee of the Red Cross, to immediately join the rescue operation and help people in the occupied part of Kherson region. Each person who dies there is a verdict on the existing international architecture and international organizations that have forgotten how to save lives. If there is no international organization in the area of this disaster now, it means that it does not exist at all, that it is incapable of functioning. All the relevant appeals from Ukraine and our government are in place., Many world leaders, heads of state, governments, and interstate associations have expressed their support for Ukraine and clear condemnation of the Russian crime of ecocide. I am grateful for this principled approach! , Together we must bring the occupiers to justice. They have controlled the dam and the entire hydroelectric power plant for more than a year. Russian propagandists were seriously and openly discussing this very scenario of a man-made disaster, which they caused. Last fall, we warned the world about Russia's mining of the Kakhovka hydroelectric power plant., We called for both sending an international observation mission to Kakhovka and demining the units and all the plant's facilities. Unfortunately, the world's attention was not enough to ensure all this. Now we must focus the world's attention on eliminating the consequences of another catastrophe caused by Russia, and we must prevent further destructive activity of the occupiers., I had several important international conversations today., Turkish President Erdoğan. I briefed him on the situation in the flooded areas, our rescue operation and urgent needs to help people., Of course, we also discussed the risks to the Zaporizhzhia NPP, which is still under the control of the occupiers. We have an agreement with the head of the IAEA to intensify the work of IAEA representatives at the plant. But it is clear that as long as the occupiers are there, there can be no complete security. Therefore, the de-occupation of Ukraine is a non-alternative task., French President Macron. We discussed in great detail all the consequences of the Russian act of terrorism at the plant and the overall situation. We discussed everything we can do to help people and the affected regions., We also thoroughly discussed defensive actions, as well as international measures that we are preparing in spite of everything, because we need security despite any aggressive and openly insane actions of Russia., Separately, I want to mention a few things that are important for our entire country, and especially for people in those regions of our country that depended on the Kakhovka reservoir., First. We will provide drinking water to everyone. In all regions, districts, cities and villages where it is necessary. All the necessary supply systems will be put in place where there is currently a delivery of drinking water. Sustainability of supply is the main principle., Second. The world will be with us. Our partners are fully informed about what is happening and what kind of help we need. Whatever the economic, social and environmental consequences of this disaster, all the basics of life will be preserved. Kherson, Mykolaiv, Zaporizhzhia, Dnipro regions – we see all the problems and will do everything possible and impossible to solve the problems created by the occupiers., Third. The direct responsibility of state and local authorities in all affected communities and regions is to help people. From the Government and the State Emergency Service to regional authorities and local communities, everyone is involved to the maximum extent possible to save and protect as many people as possible. Everyone should take this task personally. And I am grateful to those who do! Let's take care of each other and Ukraine!, And, of course, today I thank each of our warriors, all units, all brigades that continue to fight the occupiers., The Bakhmut direction, Avdiivka, all of Khortytsia, all of Tavria – great job!, No matter what, every day should be a day of destruction of the enemy., Glory to all our heroes!, Glory to all who care about Ukraine and Ukrainians!, Glory to Ukraine!"
7 June 2023  - 00:00 ,An immediate and maximum global response to Russian terror is needed – address by Volodymyr Zelenskyy on the Russian ecocide caused by the blasting of the Kakhovka HPP,", I address everyone in the world for whom life is a value. Today the Russian occupiers have committed the biggest crime of ecocide on the Ukrainian land – not only during this war, but in decades., In fact, the destroyed Kakhovka reservoir is one of the largest in Ukraine. It holds 18 billion cubic meters of water. All the structures of the Kakhovka hydroelectric power plant and its dam were located in the occupied territory. Under the full control of the Russian occupiers., Last fall, we had information that the occupiers had mined the dam of the Kakhovka hydroelectric power plant. They did it intentionally. First, to blackmail the world. Second, to blow up the dam and use the flood as a weapon. This is exactly what happened., The flood zone includes areas where more than a hundred thousand people lived before the war. Now, at least tens of thousands of people remain there., , The Kakhovka reservoir provided drinking water to a huge part of Ukraine – cities and villages with hundreds of thousands of people. It also supplied water to farmers for agricultural production in the south and center of Ukraine. Moreover, the destruction of the dam and the reservoir is a man-made strike on the environment, after which nature will have to recover for decades., Evacuation of people from the flooded area is ongoing – almost eighty settlements are under threat. An oil slick of at least 150 tons formed and was taken by the current to the Black Sea. We cannot yet predict how much of the chemicals, fertilizers and oil products stored in the flooded areas will end up in the rivers and sea., As of today, several things are clear. First, such a crime of ecocide could not have happened simply by shelling the dam. To destroy it, Russian forces had to act deliberately – mine, blow up, destroy. Secondly, no country in the world should be left alone against such terror, and I am grateful to everyone who is helping Ukraine! Thirdly, we need an immediate and maximum global response to Russian terror. From the UN Security Council to every international institution. Every state, every leader. Russian terrorists must leave our entire territory, every meter of which they are trying to use for evil and disasters. The faster the de-occupation happens, the faster the security will come., The deliberate destruction of the hydroelectric dam by terrorists looks the same from all corners of the world. For Africa, Europe, the United States, China, Australia, and India, man-made disasters are evil., We must stop the Russian evil. All other terrorists in the world must see that terror is punished by the world., Thank you to everyone who helps us to protect life! , Слава Україні!"
6 June 2023  - 22:26 ,The disaster at the Kakhovka HPP caused by Russian terrorists will not stop Ukraine and Ukrainians – address by President Volodymyr Zelenskyy,", Dear Ukrainians!, This day, which began with an urgent meeting of the National Security and Defense Council, continued with a meeting of the Staff. We are waiting for a meeting of the UN Security Council., The disaster at the Kakhovka hydroelectric power plant caused by Russian terrorists will not stop Ukraine and Ukrainians. We will still liberate all our land. And each Russian act of terrorism increases only the amount of reparations that Russia will pay for its crimes, not the chances of the occupiers to stay on our land., First of all, I am grateful to all our rescuers, military, representatives of local communities, each of our regions, who are now helping people from our southern regions flooded by the Russian terrorist attack., Second, the government at all levels is doing everything to save people and provide drinking water to those who received it from the Kakhovka reservoir. Kryvyi Rih and the entire Dnipropetrovsk region, cities and villages in Kherson, Mykolaiv and Zaporizhzhia regions – no matter how difficult it is, we have to help people., Third, I am grateful to everyone who is currently evacuating people from the towns and villages flooded by water from the Kakhovka reservoir. It is very important now to take care of each other and help as much as possible., Fourth, the whole world will know about this Russian war crime, the crime of ecocide. This deliberate destruction of the dam and other HPP facilities by the Russian occupiers is an environmental bomb of mass destruction. For the sake of their own security, the world should now show that Russia will not get away with such terror. And I am grateful to all leaders and states, all nations and international organizations that have supported Ukraine and are ready to help our people and our de-occupation efforts. The Prosecutor General has already appealed to the Office of the Prosecutor of the International Criminal Court to involve international justice in the investigation of the dam explosion., Today I spoke with IAEA Director Grossi, in particular about what happened to the Kakhovka reservoir and the general situation with the Zaporizhzhia nuclear power plant. I called on the IAEA Director to directly and unequivocally condemn today's Russian act of terrorism and to maximize our efforts to liberate the ZNPP. We agreed on his visit to Ukraine., Fifth, it is only the complete liberation of Ukrainian land from Russian occupiers that will guarantee that such acts of terrorism will not happen again. Russia uses anything for terror – any object. The terrorist state must lose., I want to say a few more things separately. Regarding our south and Crimea. We will find a way to restore normal life on our land after the expulsion of the ruscists. This applies to water and everything else. This applies to all our regions – from Kherson to Dnipropetrovsk, from Mykolaiv to Crimea., The fact that Russia deliberately destroyed the Kakhovka reservoir, which is critically important, in particular, for providing water to Crimea, indicates that the Russian occupiers have already realized that they will have to flee Crimea as well., Well, Ukraine will get back everything that belongs to it. And it will make Russia pay for what it has done., Glory to all our people who are fighting and working for the sake of our country and our people!, Today, just like yesterday, I would like to celebrate our heroes in the Bakhmut sector... Well done, warriors! The 3rd separate assault brigade and the 57th separate motorized infantry brigade - thank you! Thank you for moving forward!, Glory to Ukraine!"
